{
  "schema": "museion-geometry-evidence/1",
  "adapter_version": "r2.2",
  "page_id": "menn-metaphysics-pdf577",
  "width": 2550,
  "height": 3300,
  "provider": "paddle",
  "provider_raw": {
    "detection": {
      "input_path": "/Users/theo/AI 工作流/museion-binarize/gold-data/mixed-scholarly-v1/images/menn-metaphysics-pdf577.png",
      "page_index": null,
      "dt_polys": [
        [
          [
            1240,
            3066
          ],
          [
            1306,
            3066
          ],
          [
            1306,
            3111
          ],
          [
            1240,
            3111
          ]
        ],
        [
          [
            319,
            2953
          ],
          [
            2217,
            2949
          ],
          [
            2217,
            2997
          ],
          [
            319,
            3001
          ]
        ],
        [
          [
            294,
            2905
          ],
          [
            821,
            2905
          ],
          [
            821,
            2953
          ],
          [
            294,
            2953
          ]
        ],
        [
          [
            294,
            2857
          ],
          [
            2221,
            2857
          ],
          [
            2221,
            2901
          ],
          [
            294,
            2901
          ]
        ],
        [
          [
            295,
            2802
          ],
          [
            2183,
            2805
          ],
          [
            2183,
            2853
          ],
          [
            294,
            2850
          ]
        ],
        [
          [
            291,
            2757
          ],
          [
            1109,
            2760
          ],
          [
            1109,
            2809
          ],
          [
            291,
            2805
          ]
        ],
        [
          [
            294,
            2712
          ],
          [
            2224,
            2712
          ],
          [
            2224,
            2757
          ],
          [
            294,
            2757
          ]
        ],
        [
          [
            298,
            2671
          ],
          [
            2155,
            2671
          ],
          [
            2155,
            2705
          ],
          [
            298,
            2705
          ]
        ],
        [
          [
            294,
            2623
          ],
          [
            2200,
            2623
          ],
          [
            2200,
            2657
          ],
          [
            294,
            2657
          ]
        ],
        [
          [
            291,
            2571
          ],
          [
            2221,
            2571
          ],
          [
            2221,
            2616
          ],
          [
            291,
            2616
          ]
        ],
        [
          [
            298,
            2527
          ],
          [
            2238,
            2527
          ],
          [
            2238,
            2561
          ],
          [
            298,
            2561
          ]
        ],
        [
          [
            291,
            2472
          ],
          [
            2231,
            2468
          ],
          [
            2231,
            2516
          ],
          [
            291,
            2520
          ]
        ],
        [
          [
            294,
            2427
          ],
          [
            2107,
            2427
          ],
          [
            2107,
            2472
          ],
          [
            294,
            2472
          ]
        ],
        [
          [
            284,
            2358
          ],
          [
            2186,
            2369
          ],
          [
            2186,
            2437
          ],
          [
            284,
            2427
          ]
        ],
        [
          [
            291,
            2327
          ],
          [
            395,
            2327
          ],
          [
            395,
            2379
          ],
          [
            291,
            2379
          ]
        ],
        [
          [
            294,
            2282
          ],
          [
            2165,
            2282
          ],
          [
            2165,
            2327
          ],
          [
            294,
            2327
          ]
        ],
        [
          [
            294,
            2234
          ],
          [
            2235,
            2234
          ],
          [
            2235,
            2279
          ],
          [
            294,
            2279
          ]
        ],
        [
          [
            294,
            2186
          ],
          [
            2235,
            2186
          ],
          [
            2235,
            2231
          ],
          [
            294,
            2231
          ]
        ],
        [
          [
            294,
            2138
          ],
          [
            2228,
            2138
          ],
          [
            2228,
            2183
          ],
          [
            294,
            2183
          ]
        ],
        [
          [
            294,
            2090
          ],
          [
            2165,
            2090
          ],
          [
            2165,
            2135
          ],
          [
            294,
            2135
          ]
        ],
        [
          [
            291,
            2042
          ],
          [
            2096,
            2042
          ],
          [
            2096,
            2087
          ],
          [
            291,
            2087
          ]
        ],
        [
          [
            291,
            1994
          ],
          [
            2249,
            1994
          ],
          [
            2249,
            2038
          ],
          [
            291,
            2038
          ]
        ],
        [
          [
            294,
            1946
          ],
          [
            2200,
            1946
          ],
          [
            2200,
            1990
          ],
          [
            294,
            1990
          ]
        ],
        [
          [
            294,
            1898
          ],
          [
            2107,
            1898
          ],
          [
            2107,
            1942
          ],
          [
            294,
            1942
          ]
        ],
        [
          [
            291,
            1846
          ],
          [
            2235,
            1849
          ],
          [
            2235,
            1898
          ],
          [
            291,
            1894
          ]
        ],
        [
          [
            298,
            1808
          ],
          [
            2152,
            1808
          ],
          [
            2152,
            1842
          ],
          [
            298,
            1842
          ]
        ],
        [
          [
            294,
            1757
          ],
          [
            2193,
            1757
          ],
          [
            2193,
            1801
          ],
          [
            294,
            1801
          ]
        ],
        [
          [
            294,
            1708
          ],
          [
            2224,
            1708
          ],
          [
            2224,
            1753
          ],
          [
            294,
            1753
          ]
        ],
        [
          [
            298,
            1660
          ],
          [
            2249,
            1660
          ],
          [
            2249,
            1705
          ],
          [
            298,
            1705
          ]
        ],
        [
          [
            294,
            1612
          ],
          [
            2210,
            1612
          ],
          [
            2210,
            1657
          ],
          [
            294,
            1657
          ]
        ],
        [
          [
            291,
            1561
          ],
          [
            2224,
            1564
          ],
          [
            2224,
            1612
          ],
          [
            291,
            1609
          ]
        ],
        [
          [
            294,
            1516
          ],
          [
            2221,
            1516
          ],
          [
            2221,
            1561
          ],
          [
            294,
            1561
          ]
        ],
        [
          [
            294,
            1468
          ],
          [
            2228,
            1468
          ],
          [
            2228,
            1512
          ],
          [
            294,
            1512
          ]
        ],
        [
          [
            291,
            1416
          ],
          [
            2221,
            1420
          ],
          [
            2221,
            1468
          ],
          [
            291,
            1464
          ]
        ],
        [
          [
            298,
            1372
          ],
          [
            2172,
            1372
          ],
          [
            2172,
            1416
          ],
          [
            298,
            1416
          ]
        ],
        [
          [
            294,
            1323
          ],
          [
            2231,
            1323
          ],
          [
            2231,
            1368
          ],
          [
            294,
            1368
          ]
        ],
        [
          [
            294,
            1179
          ],
          [
            2238,
            1179
          ],
          [
            2238,
            1227
          ],
          [
            294,
            1227
          ]
        ],
        [
          [
            298,
            1121
          ],